{
  "$schema": "https://json-schema.org/draft/2020-12/schema",
  "$id": "https://chetz.app/schema/ledger-entry.schema.json",
  "title": "Chetz wallet ledger entry",
  "description": "One append-only coin movement in a player's wallet ledger (`users/{uid}/ledger/{id}`). Clients create entries with UUID v7 ids; the `syncLedger` function validates them against the economy bounds, stores accepted and rejected entries and recomputes the authoritative balance. Server-authored entries (RevenueCat purchases `rc_*`, the starting wallet) live in the same collection and carry a `server` block; clients never send `server`.",
  "type": "object",
  "required": ["id", "type", "amount", "balanceAfter", "createdAt", "deviceId", "refId"],
  "additionalProperties": false,
  "properties": {
    "id": {
      "type": "string",
      "description": "UUID v7 (time-ordered) generated by the client.",
      "pattern": "^[0-9a-f]{8}-[0-9a-f]{4}-7[0-9a-f]{3}-[89ab][0-9a-f]{3}-[0-9a-f]{12}$"
    },
    "type": {
      "type": "string",
      "enum": [
        "earn_complete", "earn_perfect", "earn_daily", "earn_streak", "earn_ad", "earn_achievement", "earn_login",
        "earn_match", "earn_coop", "earn_season", "earn_mission",
        "spend_letter", "spend_word", "spend_check", "spend_item",
        "purchase_bundle", "refund", "reconcile", "admin_adjust"
      ]
    },
    "amount": { "type": "integer", "minimum": -1000000, "maximum": 1000000, "description": "Signed coin delta: positive for earn/purchase, negative for spend/refund." },
    "balanceAfter": { "type": "integer", "minimum": -1000000, "maximum": 100000000, "description": "Balance as seen by the writer after applying this entry (the server overwrites it with the authoritative value)." },
    "createdAt": { "type": "integer", "minimum": 0, "description": "Milliseconds since the Unix epoch." },
    "deviceId": { "type": "string", "minLength": 1, "maxLength": 128 },
    "refId": {
      "description": "What the entry refers to: puzzle id for earn_complete/earn_perfect/earn_daily, ad placement or SSV id for earn_ad, achievement id, hint/item id for spends, product id for purchases; null when not applicable.",
      "oneOf": [
        { "type": "string", "minLength": 1, "maxLength": 200 },
        { "type": "null" }
      ]
    },
    "lang": { "type": "string", "enum": ["he", "en"] },
    "server": {
      "type": "object",
      "description": "Written by Cloud Functions only.",
      "required": ["status"],
      "additionalProperties": true,
      "properties": {
        "status": { "type": "string", "enum": ["accepted", "rejected"] },
        "reason": { "type": "string" },
        "source": { "type": "string" },
        "syncedAt": { "type": "integer", "minimum": 0 }
      }
    }
  }
}
